{
  "schema_version": "rewireperform-feedback-intelligence-combined-staging-postdeploy-v1",
  "evidence_status": "PASS_POSTDEPLOY_ASSURANCE_UNSIGNED_AWAITING_CONSUMER_REVIEW",
  "target": {
    "project_ref": "zbeswjipayspgvcipzmx",
    "project_name": "RewirePerform Staging",
    "region": "eu-central-1",
    "environment": "staging",
    "jurisdiction": "DE",
    "data_scope": "synthetic_only"
  },
  "accepted_predeploy": {
    "producer_commit": "1e4f3581d7d9c174fa65bf7d3475b78955b9f4c8",
    "evidence_sha256": "78caa5bd105045b5430391d70f2b905a82326f5f5e637d4cd85b5712e4d46c9e",
    "manifest_sha256": "6cb065724144a9d390432307cc524382269ce9611ffa4b607a2fb3b1cb28424e",
    "package_sha256": "8b27e88fb03081a751e2062ec263400b0736dc7d70e893c83ea2e3deefdf8e26",
    "consumer_commit": "d349421da0a5fb137ce2cb121654c78a0cda4b42",
    "consumer_acceptance_sha256": "079129b700d1a33025ea49480334eabc2aa8d9923f6d2fce233a3db79b60d235"
  },
  "remote_migrations": [
    {
      "remote_version": "20260810114642",
      "name": "feedback_text_consent_notice_v1_1",
      "local_path": "supabase/migrations/20260810122000_feedback_text_consent_notice_v1_1.sql",
      "local_sha256": "50eea80f6977972c921429db697e295dfe6134c74ea8a480c937537f549e9f6f",
      "applied": true
    },
    {
      "remote_version": "20260810114651",
      "name": "guardian_feedback_text_notice_v1_1",
      "local_path": "supabase/migrations/20260810122100_guardian_feedback_text_notice_v1_1.sql",
      "local_sha256": "3663a7f385cbf168aac2d200ced3a7aa68906de5f736a1a768e401480e1788d1",
      "applied": true
    },
    {
      "remote_version": "20260810114708",
      "name": "feedback_intelligence_transfer_pulse_count_v0_2_1",
      "local_path": "supabase/migrations/20260810122749_feedback_intelligence_transfer_pulse_count_v0_2_1.sql",
      "local_sha256": "463bf24d04eb981fa6509b47e0ce97487d8f51061f4ba514f652052399ab06e6",
      "applied": true
    }
  ],
  "database_assurance": {
    "executed_at": "2026-08-10T11:53:38.076999+00:00",
    "audit_phase": "POSTDEPLOY_ASSURANCE",
    "audit_result_path": "docs/feedback-intelligence/contracts/combined-staging-postdeploy-v0.1/remote-audit-result-2026-08-10.json",
    "audit_result_sha256": "2c7ea549a01f8403b4495dd17bd1a6cfdb7f5f80e72e7943e63f01bf6a83d006",
    "audit_sql_sha256": "7f7865f769f46bfab204c37d071ee743636fe183f6d6876a24557e51dc508bd3",
    "application_rows_read": false,
    "application_functions_called": false,
    "database_mutated": false,
    "contract_version": "0.2.1-draft",
    "schema_version": "rewire-feedback-intelligence-export-v0.2.1-draft",
    "contract_status": "PRODUCER_CONFIRMED_DRAFT_NOT_ACTIVATED",
    "activation_flags_closed": true,
    "four_draft_campaigns_pinned": true,
    "guardian_draft_exact": true,
    "reader_password_is_null": true,
    "standard_runtime_execute_denied": true,
    "reader_execute_allowlisted": true,
    "reader_direct_relation_privileges": 0,
    "reader_direct_sequence_privileges": 0,
    "function_definition_sha256": {
      "gateway": "d08d3fbf17420570ad6e8f29f0e3e19717a874f19a767c8eb7c7656acf7aedfd",
      "internal_export": "534d0d8770899566658b7efb68c6bc31cfecc068dcf5cf94c30f09143b2ab043"
    }
  },
  "edge_assurance": {
    "slug": "mahleos-feedback-intelligence-read",
    "deployment_id": "4579d2b9-16c9-4387-be84-d5a5b440265e",
    "observed_version": 25,
    "status": "ACTIVE",
    "verify_jwt": false,
    "ezbr_sha256": "ff2e9862d07cf237f906c861e0c81e9760f6d56f8a3f3a0251cdeeb9e9c8900c",
    "source_file_count": 6,
    "source_manifest_sha256": "cd76527cbe5bd3accfc7b64c8860b2ad5a11042bcecb2f5b4722510255f2eb6a",
    "deployed_source_byte_match": true
  },
  "advisor_assurance": {
    "security_errors": 0,
    "performance_errors": 0,
    "new_block_finding": false,
    "private_tables_have_client_privileges": false,
    "intentional_private_rls_info_count": 3
  },
  "gates": {
    "feedback_collection_enabled": false,
    "text_collection_enabled": false,
    "minor_policy_enabled": false,
    "guardian_policy_enabled": false,
    "consumer_pin_enabled": false,
    "synthetic_export_enabled": false,
    "reader_password_provisioned": false,
    "machine_key_provisioned_by_this_gate": false,
    "credential_mutation_performed": false,
    "network_read_performed": false,
    "export_function_called": false,
    "production_export_enabled": false,
    "real_data_read_enabled": false,
    "push_performed": false,
    "merge_performed": false,
    "app_store_release_authorized": false
  },
  "next_gate": {
    "decision": "AWAITING_CONSUMER_POSTDEPLOY_REVIEW",
    "consumer_review_required": true,
    "credentials_allowed": false,
    "network_read_allowed": false,
    "production_allowed": false
  }
}
